{
  "bound_hashes": {
    "document_xml_sha256": "ebefbf16e4f7bcae2907d6655d72a3e374cc4b2b6f185380203403f61a2bdf8a",
    "receipt_set_sha256": "e2264be13ad19fd4495a1925ba17163de9e710edda5760616dbd996c35222211",
    "source_document_sha256": "01fe95607f4733e2b47a4c46f8dad5817d6014cc40f69a08631977c9d890cd8f",
    "store_records_sha256": "9660f38d1234373c06aaee6e85c4e6c64478aa7ba1ab04546137c2428735b1fb"
  },
  "candidate_ids": [
    "formula-01",
    "formula-02",
    "formula-03"
  ],
  "evidence_envelope_sha256": "0bbcff5b1c2942b225cd78c04d147beeb04dfc498a8a89dc785c9eea24516bd0",
  "exact_cohort": [
    "formula-01",
    "formula-02",
    "formula-03"
  ],
  "fact_card_bindings_sha256": "db7ea5451a909edcdb076f7ab80670407484218aabfa55a73c9d9d2f8c979c79",
  "fact_cards_sha256": "84060e0ed7ca3d42e8ca2bdc94f9e46fae87e1c12a912d8d996261982ca4284a",
  "inventory_reconciliation_sha256": "d7767ad22888c789ea21e42bcc5da7222f6ee89eae5c312051d442c55518887b",
  "record_count": 4,
  "schema_version": "formulation-data-package/v1"
}
